{
  "id": "ED-004",
  "namespace": "film.core",
  "version": "1.0.0",
  "module_id": "ED",
  "title": "Nén thời gian, lược việc và giữ nhân quả",
  "level": "trung_cap",
  "status": "active",
  "knowledge_kind": "practical_guidance",
  "decision_question": "Bước nào có thể bỏ mà người xem vẫn hiểu?",
  "use_when": [
    "Khi công đoạn dài, lặp hoặc vượt thời lượng phim."
  ],
  "principle": "Giữ mốc bắt đầu, biến đổi quan trọng và kết quả; nén phần lặp. Chỉ cho thời gian cụ thể khi nguồn đủ xác nhận.",
  "actions": [
    "Lập chuỗi trạng thái thực trước khi rút gọn.",
    "Giữ bước gây ra kết quả khó suy ra.",
    "Dùng cảnh chuyển hoặc thay đổi vật/thời điểm để báo khoảng lược."
  ],
  "tradeoffs": [
    "Nén nhiều làm tiến độ dễ xem nhưng có thể che kỹ thuật hoặc quy luật tự nhiên."
  ],
  "verification": [
    "Không tạo hiểu nhầm cây lớn tức thì hay món chín chỉ sau một động tác.",
    "Không tự gán cùng một mẻ/nguyên liệu qua các cảnh chưa xác minh."
  ],
  "original_example": "Gieo, tín hiệu thời gian rồi cây lớn; không nhất thiết phải quay mọi ngày.",
  "counterexample": "Video dạy thao tác có thể cần giữ bước lặp để người mới hiểu cách làm.",
  "prerequisite_ids": [
    "EV-001"
  ],
  "related_ids": [
    "MO-006",
    "ST-005",
    "EV-006"
  ],
  "source_ids": [
    "B017",
    "B024"
  ],
  "evidence_policy": {
    "basis": "editorial_synthesis_with_scoped_references",
    "audience_effect": "conditional_hypothesis",
    "generation_tested": false,
    "viewer_tested": false,
    "note": "Nguồn được dùng trong phạm vi ghi ở sổ nguồn; các bước, ví dụ và phản ví dụ là biên soạn thực hành, không phải thử nghiệm xác nhận hiệu quả."
  },
  "updated_on": "2026-10-18"
}
