{
  "id": "MO-004",
  "namespace": "film.core",
  "version": "1.0.0",
  "module_id": "MO",
  "title": "Tiến máy, zoom và crop",
  "level": "trung_cap",
  "status": "active",
  "knowledge_kind": "practical_guidance",
  "decision_question": "Muốn thay quan hệ không gian hay chỉ thay vùng nhìn?",
  "use_when": [
    "Khi cần đến gần hoặc chỉnh khung hậu kỳ."
  ],
  "principle": "Dolly thay vị trí; zoom thay tiêu cự/góc nhìn quang học; crop/phóng hậu kỳ chọn vùng ảnh. Chúng không mặc định tạo cùng biến đổi phối cảnh.",
  "actions": [
    "Chọn mục đích: gần gũi, lộ thông tin hay chỉnh khuôn.",
    "Ghi thay đổi chủ thể và nền mong muốn.",
    "Nếu cần chính xác, kiểm video bằng vật mốc và metadata có sẵn."
  ],
  "tradeoffs": [
    "Crop có thể tiết kiệm tạo lại nhưng làm giảm phần thông tin/độ phân giải sử dụng."
  ],
  "verification": [
    "Không gọi mọi phóng to là máy tiến.",
    "Phương án xử lý hậu kỳ có đủ chất lượng ở kích thước xuất."
  ],
  "original_example": "Tiến gần bàn tay có thể thay tương quan với nền; crop một khung tĩnh chỉ làm vùng đã có lớn hơn.",
  "counterexample": "Zoom là lựa chọn có chủ ý, không phải dấu hiệu AI hiểu sai trong mọi trường hợp.",
  "prerequisite_ids": [
    "EV-001"
  ],
  "related_ids": [
    "CA-008",
    "MO-003",
    "AI-008"
  ],
  "source_ids": [
    "B001",
    "B015",
    "B028"
  ],
  "evidence_policy": {
    "basis": "editorial_synthesis_with_scoped_references",
    "audience_effect": "conditional_hypothesis",
    "generation_tested": false,
    "viewer_tested": false,
    "note": "Nguồn được dùng trong phạm vi ghi ở sổ nguồn; các bước, ví dụ và phản ví dụ là biên soạn thực hành, không phải thử nghiệm xác nhận hiệu quả."
  },
  "updated_on": "2026-10-18"
}
