{
  "id": "EV-003",
  "namespace": "film.core",
  "version": "1.0.0",
  "module_id": "EV",
  "title": "Phân tích từ toàn phim đến sự kiện",
  "level": "co_ban",
  "status": "active",
  "knowledge_kind": "practical_guidance",
  "decision_question": "Chi tiết này đang làm nhiệm vụ gì trong chuỗi?",
  "use_when": [
    "Khi bóc phim dài, tập phim hoặc nhiều đoạn được tải riêng."
  ],
  "principle": "Tổ chức toàn phim, phân đoạn, chuỗi hành động, shot và sự kiện trong shot. Quan hệ trước–sau giải thích vai trò của chi tiết.",
  "actions": [
    "Xác định mục tiêu và biến đổi của toàn phim trước.",
    "Chia phân đoạn theo việc/thông tin/trạng thái thay đổi, không chỉ theo phút.",
    "Gắn từng shot và sự kiện vào đơn vị cha; ghi quan hệ nối."
  ],
  "tradeoffs": [
    "Phân tầng quá vụn làm khó tra cứu; chỉ tách khi có thay đổi đáng dùng."
  ],
  "verification": [
    "Shot có đơn vị cha và một chức năng mô tả được.",
    "Tổng hợp cấp trên không mâu thuẫn với bằng chứng cấp dưới."
  ],
  "original_example": "Cận hạt vào đất thuộc việc gieo, rồi thuộc chu kỳ trồng–thu; không chỉ gắn nhãn macro.",
  "counterexample": "Một cú máy dài có thể chứa nhiều nhịp diễn biến nhưng vẫn là một shot.",
  "prerequisite_ids": [],
  "related_ids": [
    "ST-003",
    "ST-005",
    "ED-001"
  ],
  "source_ids": [
    "B012",
    "B017",
    "B024"
  ],
  "evidence_policy": {
    "basis": "editorial_synthesis_with_scoped_references",
    "audience_effect": "conditional_hypothesis",
    "generation_tested": false,
    "viewer_tested": false,
    "note": "Nguồn được dùng trong phạm vi ghi ở sổ nguồn; các bước, ví dụ và phản ví dụ là biên soạn thực hành, không phải thử nghiệm xác nhận hiệu quả."
  },
  "updated_on": "2026-10-18"
}
