{
  "id": "CA-004",
  "namespace": "film.core",
  "version": "1.0.0",
  "module_id": "CA",
  "title": "Địa lý màn hình và hướng liên tục",
  "level": "trung_cap",
  "status": "active",
  "knowledge_kind": "practical_guidance",
  "decision_question": "Qua điểm cắt, người xem có giữ được ai ở đâu không?",
  "use_when": [
    "Khi có nhiều góc, người di chuyển hoặc hội thoại."
  ],
  "principle": "Duy trì hoặc chủ động thay đổi quan hệ trái–phải, hướng đi và hướng nhìn. Trục 180 độ là công cụ định hướng, không luật cấm phá.",
  "actions": [
    "Vẽ trục hành động và vị trí các góc dự định.",
    "Kiểm hướng nhìn/đi và vị trí vật qua cut.",
    "Khi đổi bên trục, dùng tín hiệu tái định hướng hoặc mục đích rõ."
  ],
  "tradeoffs": [
    "Giữ trục cứng có thể hạn chế góc hữu ích; đổi trục không báo dễ gây lạc hướng."
  ],
  "verification": [
    "Người xem xác định được quan hệ không cần nhìn lại.",
    "Chủ ý gây mất định hướng được ghi trong bản yêu cầu."
  ],
  "original_example": "Người nhìn ra cửa ở bên phải; góc tiếp cho thấy cửa phù hợp quan hệ đã thiết lập.",
  "counterexample": "Cảnh nhìn thẳng theo trục hoặc chuyển máy liên tục có thể giúp đổi bên dễ hiểu.",
  "prerequisite_ids": [
    "EV-001"
  ],
  "related_ids": [
    "DR-002",
    "ED-003",
    "EV-004"
  ],
  "source_ids": [
    "B013",
    "B027"
  ],
  "evidence_policy": {
    "basis": "editorial_synthesis_with_scoped_references",
    "audience_effect": "conditional_hypothesis",
    "generation_tested": false,
    "viewer_tested": false,
    "note": "Nguồn được dùng trong phạm vi ghi ở sổ nguồn; các bước, ví dụ và phản ví dụ là biên soạn thực hành, không phải thử nghiệm xác nhận hiệu quả."
  },
  "updated_on": "2026-10-18"
}
